### ISSUE TITLE
Need to specify configuration settings for firewall to make Airplayer works

### ISSUE THREAD

**Issue by medaminezghal** [iDescriptor/iDescriptor#73]
I was able to discover the device but I couldn't connect until I disable the firewall service.

I think you need to add documentation about how to configure the firewall or add it automatically like the UDEV rules.

**Comment by uncor3** [comment]
Good suggestion @medaminezghal , can you try these please ? I am assuming you use ufw
```
sudo ufw allow 5353/udp # Avahi/Bonjour
sudo ufw allow 7000/tcp # AirPlay streaming
sudo ufw allow 7100/tcp # Mirroring
sudo ufw allow 6000:7000/udp # Dynamic ports for video/audio

Then
sudo ufw reload
sudo ufw status
```

If it worked for you we can check if these ports are open in dependency check, and i can add docs about this

**Comment by medaminezghal** [comment]
@uncor3 I’m using firewalld, I will try to add those exceptions and try again. But using tcpdump I’ve noticed that it use the port 32803:
```

$ sudo tcpdump -i enp34s0 host 192.168.1.13 -n
tcpdump: verbose output suppressed, use -v[v]… for full protocol decode
listening on enp34s0, link-type EN10MB (Ethernet), snapshot length 262144 bytes
08:41:08.326318 IP 192.168.1.13.49860 > 146.75.121.91.443: Flags [P.], seq 4263004184:4263004216, ack 3630155542, win 63, options [nop,nop,TS val 1022998773 ecr 1011410647], length 32
08:41:08.384381 IP 146.75.121.91.443 > 192.168.1.13.49860: Flags [.], ack 32, win 278, options [nop,nop,TS val 1011417946 ecr 1022998773], length 0
08:41:09.902753 IP 192.168.1.13.39032 > 34.54.194.141.443: Flags [P.], seq 2909901334:2909901373, ack 3638537180, win 63, options [nop,nop,TS val 1736282033 ecr 3423473554], length 39
08:41:09.957683 IP 34.54.194.141.443 > 192.168.1.13.39032: Flags [.], ack 39, win 1031, options [nop,nop,TS val 3423532276 ecr 1736282033], length 0
08:41:09.957684 IP 34.54.194.141.443 > 192.168.1.13.39032: Flags [P.], seq 1:40, ack 39, win 1031, options [nop,nop,TS val 3423532276 ecr 1736282033], length 39
08:41:09.998399 IP 192.168.1.13.39032 > 34.54.194.141.443: Flags [.], ack 40, win 63, options [nop,nop,TS val 1736282129 ecr 3423532276], length 0
08:41:10.847841 IP 192.168.1.13.5353 > 224.0.0.251.5353: 0 [2q] [4n] ANY (QM)? 2CF05DDC1356@iDescriptor@UxPlay._raop._tcp.local. ANY (QM)? iDescriptor@UxPlay._airplay._tcp.local. (625)
08:41:11.098406 IP 192.168.1.13.5353 > 224.0.0.251.5353: 0 [2q] [4n] ANY (QM)? 2CF05DDC1356@iDescriptor@UxPlay._raop._tcp.local. ANY (QM)? iDescriptor@UxPlay._airplay._tcp.local. (625)
08:41:11.348925 IP 192.168.1.13.5353 > 224.0.0.251.5353: 0 [2q] [4n] ANY (QM)? 2CF05DDC1356@iDescriptor@UxPlay._raop._tcp.local. ANY (QM)? iDescriptor@UxPlay._airplay._tcp.local. (625)
08:41:11.549374 IP 192.168.1.13.5353 > 224.0.0.251.5353: 0*- [0q] 6/0/0 (Cache flush) TXT “ch=2” “cn=0,1,2,3” “da=true” “et=0,3,5” “vv=2” “ft=0x527FFEE6,0x0” “am=AppleTV3,2” “md=0,1,2” “rhd=5.6.0.0” “pw=false” “sr=44100” “ss=16” “sv=false” “tp=UDP” “txtvers=1” “sf=0x4” “vs=220.68” “vn=65537” “pk=7a9aea43c56e7d80c659e5e2c66d36b8f98eccbc015af6dd20c7a8668a2573d4”, PTR 2CF05DDC1356@iDescriptor@UxPlay._raop._tcp.local., (Cache flush) SRV MAZDesktop.local.:32803 0 0, (Cache flush) AAAA fe80::a90c:fd05:6c33:dd90, (Cache flush) A 192.168.1.13, PTR _raop._tcp.local. (433)
08:41:11.550616 IP 192.168.1.13.5353 > 224.0.0.251.5353: 0*- [0q] 4/0/0 (Cache flush) TXT “deviceid=2c:f0:5d:dc:13:56” “features=0x527FFEE6,0x0” “pw=false” “flags=0x4” “model=AppleTV3,2” “pk=7a9aea43c56e7d80c659e5e2c66d36b8f98eccbc015af6dd20c7a8668a2573d4” “pi=2e388006-13ba-4041-9a67-25dd4a43d536” “srcvers=220.68” “vv=2”, PTR iDescriptor@UxPlay._airplay._tcp.local., (Cache flush) SRV MAZDesktop.local.:32803 0 0, PTR _airplay._tcp.local. (359)
08:41:12.609042 IP 192.168.1.13.5353 > 224.0.0.251.5353: 0*- [0q] 10/0/0 (Cache flush) TXT “ch=2” “cn=0,1,2,3” “da=true” “et=0,3,5” “vv=2” “ft=0x527FFEE6,0x0” “am=AppleTV3,2” “md=0,1,2” “rhd=5.6.0.0” “pw=false” “sr=44100” “ss=16” “sv=false” “tp=UDP” “txtvers=1” “sf=0x4” “vs=220.68” “vn=65537” “pk=7a9aea43c56e7d80c659e5e2c66d36b8f98eccbc015af6dd20c7a8668a2573d4”, PTR iDescriptor@UxPlay._airplay._tcp.local., (Cache flush) SRV MAZDesktop.local.:32803 0 0, (Cache flush) AAAA fe80::a90c:fd05:6c33:dd90, (Cache flush) A 192.168.1.13, (Cache flush) TXT “deviceid=2c:f0:5d:dc:13:56” “features=0x527FFEE6,0x0” “pw=false” “flags=0x4” “model=AppleTV3,2” “pk=7a9aea43c56e7d80c659e5e2c66d36b8f98eccbc015af6dd20c7a8668a2573d4” “pi=2e388006-13ba-4041-9a67-25dd4a43d536” “srcvers=220.68” “vv=2”, PTR _airplay._tcp.local., PTR 2CF05DDC1356@iDescriptor@UxPlay._raop._tcp.local., (Cache flush) SRV MAZDesktop.local.:32803 0 0, PTR _raop._tcp.local. (736)
08:41:14.667923 IP 192.168.1.13.5353 > 224.0.0.251.5353: 0*- [0q] 10/0/0 (Cache flush) TXT “ch=2” “cn=0,1,2,3” “da=true” “et=0,3,5” “vv=2” “ft=0x527FFEE6,0x0” “am=AppleTV3,2” “md=0,1,2” “rhd=5.6.0.0” “pw=false” “sr=44100” “ss=16” “sv=false” “tp=UDP” “txtvers=1” “sf=0x4” “vs=220.68” “vn=65537” “pk=7a9aea43c56e7d80c659e5e2c66d36b8f98eccbc015af6dd20c7a8668a2573d4”, PTR iDescriptor@UxPlay._airplay._tcp.local., (Cache flush) SRV MAZDesktop.local.:32803 0 0, (Cache flush) AAAA fe80::a90c:fd05:6c33:dd90, (Cache flush) A 192.168.1.13, (Cache flush) TXT “deviceid=2c:f0:5d:dc:13:56” “features=0x527FFEE6,0x0” “pw=false” “flags=0x4” “model=AppleTV3,2” “pk=7a9aea43c56e7d80c659e5e2c66d36b8f98eccbc015af6dd20c7a8668a2573d4” “pi=2e388006-13ba-4041-9a67-25dd4a43d536” “srcvers=220.68” “vv=2”, PTR _airplay._tcp.local., PTR 2CF05DDC1356@iDescriptor@UxPlay._raop._tcp.local., (Cache flush) SRV MAZDesktop.local.:32803 0 0, PTR _raop._tcp.local. (736)
08:41:15.415803 ARP, Request who-has 192.168.1.13 (2c:f0:5d:dc:13:56) tell 192.168.1.14, length 46
08:41:15.415815 ARP, Reply 192.168.1.13 is-at 2c:f0:5d:dc:13:56, length 28
08:41:15.415903 IP 192.168.1.14.5353 > 192.168.1.13.5353: 0 PTR (QU)? _airplay._tcp.local. (37)
08:41:15.415938 IP 192.168.1.13 > 192.168.1.14: ICMP host 192.168.1.13 unreachable - admin prohibited filter, length 73
08:41:15.416036 ARP, Request who-has 192.168.1.13 (2c:f0:5d:dc:13:56) tell 192.168.1.14, length 46
08:41:15.416040 ARP, Reply 192.168.1.13 is-at 2c:f0:5d:dc:13:56, length 28
08:41:15.416149 IP 192.168.1.14.5353 > 192.168.1.13.5353: 0 PTR (QU)? _raop._tcp.local. (34)
08:41:15.416165 IP 192.168.1.13 > 192.168.1.14: ICMP host 192.168.1.13 unreachable - admin prohibited filter, length 70
08:41:15.699171 IP 192.168.1.14.57715 > 192.168.1.13.32803: Flags [SEW], seq 120056540, win 65535, options [mss 1460,nop,wscale 6,nop,nop,TS val 3244598200 ecr 0,sackOK,eol], length 0
08:41:15.699188 IP 192.168.1.13 > 192.168.1.14: ICMP host 192.168.1.13 unreachable - admin prohibited filter, length 72
08:41:16.388222 IP 146.75.121.91.443 > 192.168.1.13.49860: Flags [P.], seq 1:29, ack 32, win 278, options [nop,nop,TS val 1011425949 ecr 1022998773], length 28
08:41:16.388245 IP 192.168.1.13.49860 > 146.75.121.91.443: Flags [.], ack 29, win 63, options [nop,nop,TS val 1023006835 ecr 1011425949], length 0
08:41:18.222230 IP 192.168.1.14.57716 > 192.168.1.13.32803: Flags [SEW], seq 459869158, win 65535, options [mss 1460,nop,wscale 6,nop,nop,TS val 611625543 ecr 0,sackOK,eol], length 0
08:41:18.222273 IP 192.168.1.13 > 192.168.1.14: ICMP host 192.168.1.13 unreachable - admin prohibited filter, length 72
08:41:18.249196 IP 192.168.1.14.57716 > 192.168.1.13.32803: Flags [S], seq 459869158, win 65535, options [mss 1460,nop,wscale 6,nop,nop,TS val 611625583 ecr 0,sackOK,eol], length 0
08:41:18.249214 IP 192.168.1.13 > 192.168.1.14: ICMP host 192.168.1.13 unreachable - admin prohibited filter, length 72
08:41:20.624423 ARP, Request who-has 192.168.1.14 tell 192.168.1.13, length 28
08:41:20.626860 ARP, Reply 192.168.1.14 is-at 48:35:2b:40:81:9b, length 46
08:41:20.752271 IP 192.168.1.14.57717 > 192.168.1.13.32803: Flags [SEW], seq 1712805997, win 65535, options [mss 1460,nop,wscale 6,nop,nop,TS val 1350942043 ecr 0,sackOK,eol], length 0
08:41:20.752297 IP 192.168.1.13 > 192.168.1.14: ICMP host 192.168.1.13 unreachable - admin prohibited filter, length 72
08:41:23.261447 IP 192.168.1.14.57718 > 192.168.1.13.32803: Flags [SEW], seq 3343331982, win 65535, options [mss 1460,nop,wscale 6,nop,nop,TS val 3017314078 ecr 0,sackOK,eol], length 0
08:41:23.261480 IP 192.168.1.13 > 192.168.1.14: ICMP host 192.168.1.13 unreachable - admin prohibited filter, length 72
08:41:23.326899 IP 192.168.1.13.49860 > 146.75.121.91.443: Flags [P.], seq 32:64, ack 29, win 63, options [nop,nop,TS val 1023013774 ecr 1011425949], length 32
08:41:23.384635 IP 146.75.121.91.443 > 192.168.1.13.49860: Flags [.], ack 64, win 278, options [nop,nop,TS val 1011432946 ecr 1023013774], length 0
08:41:25.356184 IP 192.168.1.14.57719 > 192.168.1.13.32803: Flags [SEW], seq 3589879454, win 65535, options [mss 1460,nop,wscale 6,nop,nop,TS val 2904694011 ecr 0,sackOK,eol], length 0
08:41:25.356227 IP 192.168.1.13 > 192.168.1.14: ICMP host 192.168.1.13 unreachable - admin prohibited filter, length 72
08:41:27.853156 IP 192.168.1.14.57720 > 192.168.1.13.32803: Flags [SEW], seq 2455808953, win 65535, options [mss 1460,nop,wscale 6,nop,nop,TS val 3915409733 ecr 0,sackOK,eol], length 0
08:41:27.853203 IP 192.168.1.13 > 192.168.1.14: ICMP host 192.168.1.13 unreachable - admin prohibited filter, length 72
08:41:30.353960 IP 192.168.1.14.57721 > 192.168.1.13.32803: Flags [SEW], seq 4096731083, win 65535, options [mss 1460,nop,wscale 6,nop,nop,TS val 3665616690 ecr 0,sackOK,eol], length 0
08:41:30.354005 IP 192.168.1.13 > 192.168.1.14: ICMP host 192.168.1.13 unreachable - admin prohibited filter, length 72
08:41:32.769808 IP 146.75.121.91.443 > 192.168.1.13.49860: Flags [P.], seq 29:57, ack 64, win 278, options [nop,nop,TS val 1011442331 ecr 1023013774], length 28
08:41:32.769842 IP 192.168.1.13.49860 > 146.75.121.91.443: Flags [.], ack 57, win 63, options [nop,nop,TS val 1023023217 ecr 1011442331], length 0
08:41:32.894971 IP 192.168.1.14.57722 > 192.168.1.13.32803: Flags [SEW], seq 2217918915, win 65535, options [mss 1460,nop,wscale 6,nop,nop,TS val 835320352 ecr 0,sackOK,eol], length 0
08:41:32.894971 IP 192.168.1.14.57722 > 192.168.1.13.32803: Flags [S], seq 2217918915, win 65535, options [mss 1460,nop,wscale 6,nop,nop,TS val 835320392 ecr 0,sackOK,eol], length 0
08:41:32.895003 IP 192.168.1.13 > 192.168.1.14: ICMP host 192.168.1.13 unreachable - admin prohibited filter, length 72
08:41:32.895012 IP 192.168.1.13 > 192.168.1.14: ICMP host 192.168.1.13 unreachable - admin prohibited filter, length 72
08:41:33.886653 IP 146.75.121.91.443 > 192.168.1.13.49860: Flags [P.], seq 57:85, ack 64, win 278, options [nop,nop,TS val 1011443447 ecr 1023023217], length 28
08:41:33.886694 IP 192.168.1.13.49860 > 146.75.121.91.443: Flags [.], ack 85, win 63, options [nop,nop,TS val 1023024334 ecr 1011443447], length 0
08:41:34.745126 IP 146.75.121.91.443 > 192.168.1.13.49860: Flags [P.], seq 85:113, ack 64, win 278, options [nop,nop,TS val 1011444306 ecr 1023024334], length 28
08:41:34.745162 IP 192.168.1.13.49860 > 146.75.121.91.443: Flags [.], ack 113, win 63, options [nop,nop,TS val 1023025192 ecr 1011444306], length 0
08:41:35.352899 IP 192.168.1.14.57724 > 192.168.1.13.32803: Flags [SEW], seq 967386756, win 65535, options [mss 1460,nop,wscale 6,nop,nop,TS val 230263068 ecr 0,sackOK,eol], length 0
08:41:35.352943 IP 192.168.1.13 > 192.168.1.14: ICMP host 192.168.1.13 unreachable - admin prohibited filter, length 72
08:41:37.853429 IP 192.168.1.14.57725 > 192.168.1.13.32803: Flags [SEW], seq 590514165, win 65535, options [mss 1460,nop,wscale 6,nop,nop,TS val 2228801377 ecr 0,sackOK,eol], length 0
08:41:37.853473 IP 192.168.1.13 > 192.168.1.14: ICMP host 192.168.1.13 unreachable - admin prohibited filter, length 72
08:41:38.170697 IP 192.168.1.13.40980 > 185.199.109.133.443: Flags [F.], seq 3756940068, ack 193586007, win 77, options [nop,nop,TS val 3404147495 ecr 1782245308], length 0
08:41:38.221011 IP 185.199.109.133.443 > 192.168.1.13.40980: Flags [.], ack 1, win 281, options [nop,nop,TS val 1782302278 ecr 3404147495], length 0
08:41:38.221216 IP 185.199.109.133.443 > 192.168.1.13.40980: Flags [P.], seq 1:25, ack 1, win 281, options [nop,nop,TS val 1782302278 ecr 3404147495], length 24
08:41:38.221228 IP 192.168.1.13.40980 > 185.199.109.133.443: Flags [R], seq 3756940069, win 0, length 0
08:41:38.221255 IP 185.199.109.133.443 > 192.168.1.13.40980: Flags [F.], seq 25, ack 1, win 281, options [nop,nop,TS val 1782302278 ecr 3404147495], length 0
08:41:38.221261 IP 192.168.1.13.40980 > 185.199.109.133.443: Flags [R], seq 3756940069, win 0, length 0
08:41:38.327402 IP 192.168.1.13.49860 > 146.75.121.91.443: Flags [P.], seq 64:96, ack 113, win 63, options [nop,nop,TS val 1023028775 ecr 1011444306], length 32
08:41:38.385328 IP 146.75.121.91.443 > 192.168.1.13.49860: Flags [.], ack 96, win 278, options [nop,nop,TS val 1011447946 ecr 1023028775], length 0
08:41:39.547541 IP 23.209.208.55.443 > 192.168.1.13.50574: Flags [P.], seq 1881117354:1881117378, ack 2549061431, win 567, options [nop,nop,TS val 2767013892 ecr 3497287960], length 24
08:41:39.547581 IP 192.168.1.13.50574 > 23.209.208.55.443: Flags [.], ack 24, win 84, options [nop,nop,TS val 3497407893 ecr 2767013892], length 0
08:41:39.547752 IP 23.209.208.55.443 > 192.168.1.13.50574: Flags [F.], seq 24, ack 1, win 567, options [nop,nop,TS val 2767013892 ecr 3497287960], length 0
08:41:39.547802 IP 192.168.1.13.50574 > 23.209.208.55.443: Flags [F.], seq 1, ack 25, win 84, options [nop,nop,TS val 3497407893 ecr 2767013892], length 0
08:41:39.605148 IP 23.209.208.55.443 > 192.168.1.13.50574: Flags [.], ack 2, win 567, options [nop,nop,TS val 2767013949 ecr 3497407893], length 0
08:41:39.903534 IP 192.168.1.13.58826 > 146.75.123.6.443: Flags [F.], seq 3637435295, ack 3365836605, win 90, options [nop,nop,TS val 3479000256 ecr 399448427], length 0
08:41:39.962904 IP 146.75.123.6.443 > 192.168.1.13.58826: Flags [.], ack 1, win 279, options [nop,nop,TS val 399507129 ecr 3479000256], length 0
08:41:39.962904 IP 146.75.123.6.443 > 192.168.1.13.58826: Flags [P.], seq 1:25, ack 1, win 279, options [nop,nop,TS val 399507129 ecr 3479000256], length 24
08:41:39.962965 IP 192.168.1.13.58826 > 146.75.123.6.443: Flags [R], seq 3637435296, win 0, length 0
08:41:39.963123 IP 146.75.123.6.443 > 192.168.1.13.58826: Flags [F.], seq 25, ack 1, win 279, options [nop,nop,TS val 399507129 ecr 3479000256], length 0
08:41:39.963136 IP 192.168.1.13.58826 > 146.75.123.6.443: Flags [R], seq 3637435296, win 0, length 0
08:41:40.353791 IP 192.168.1.14.57726 > 192.168.1.13.32803: Flags [SEW], seq 3665785453, win 65535, options [mss 1460,nop,wscale 6,nop,nop,TS val 534309765 ecr 0,sackOK,eol], length 0
08:41:40.353834 IP 192.168.1.13 > 192.168.1.14: ICMP host 192.168.1.13 unreachable - admin prohibited filter, length 72
08:41:42.870318 IP 192.168.1.14.57727 > 192.168.1.13.32803: Flags [SEW], seq 3782032025, win 65535, options [mss 1460,nop,wscale 6,nop,nop,TS val 722602328 ecr 0,sackOK,eol], length 0
08:41:42.870361 IP 192.168.1.13 > 192.168.1.14: ICMP host 192.168.1.13 unreachable - admin prohibited filter, length 72
08:41:45.352190 IP 192.168.1.14.57728 > 192.168.1.13.32803: Flags [SEW], seq 3804825342, win 65535, options [mss 1460,nop,wscale 6,nop,nop,TS val 1654162880 ecr 0,sackOK,eol], length 0
08:41:45.352233 IP 192.168.1.13 > 192.168.1.14: ICMP host 192.168.1.13 unreachable - admin prohibited filter, length 72
08:41:45.712390 ARP, Request who-has 192.168.1.14 tell 192.168.1.13, length 28
08:41:45.715136 ARP, Reply 192.168.1.14 is-at 48:35:2b:40:81:9b, length 46
08:41:47.961161 IP 192.168.1.13.5353 > 224.0.0.251.5353: 0*- [0q] 10/0/0 PTR _airplay._tcp.local., PTR 2CF05DDC1356@iDescriptor@UxPlay._raop._tcp.local., (Cache flush) SRV MAZDesktop.local.:32803 0 0, (Cache flush) AAAA fe80::a90c:fd05:6c33:dd90, (Cache flush) A 192.168.1.13, (Cache flush) TXT “ch=2” “cn=0,1,2,3” “da=true” “et=0,3,5” “vv=2” “ft=0x527FFEE6,0x0” “am=AppleTV3,2” “md=0,1,2” “rhd=5.6.0.0” “pw=false” “sr=44100” “ss=16” “sv=false” “tp=UDP” “txtvers=1” “sf=0x4” “vs=220.68” “vn=65537” “pk=7a9aea43c56e7d80c659e5e2c66d36b8f98eccbc015af6dd20c7a8668a2573d4”, PTR _raop._tcp.local., PTR iDescriptor@UxPlay._airplay._tcp.local., (Cache flush) SRV MAZDesktop.local.:32803 0 0, (Cache flush) TXT “deviceid=2c:f0:5d:dc:13:56” “features=0x527FFEE6,0x0” “pw=false” “flags=0x4” “model=AppleTV3,2” “pk=7a9aea43c56e7d80c659e5e2c66d36b8f98eccbc015af6dd20c7a8668a2573d4” “pi=2e388006-13ba-4041-9a67-25dd4a43d536” “srcvers=220.68” “vv=2” (736)
08:41:48.014336 IP 192.168.1.14.5353 > 192.168.1.13.5353: 0 TXT (QU)? iDescriptor@UxPlay._airplay._tcp.local. (56)
08:41:48.014358 IP 192.168.1.13 > 192.168.1.14: ICMP host 192.168.1.13 unreachable - admin prohibited filter, length 92
08:41:48.705573 IP 146.75.121.91.443 > 192.168.1.13.49860: Flags [P.], seq 113:141, ack 96, win 278, options [nop,nop,TS val 1011458266 ecr 1023028775], length 28
08:41:48.705614 IP 192.168.1.13.49860 > 146.75.121.91.443: Flags [.], ack 141, win 63, options [nop,nop,TS val 1023039153 ecr 1011458266], length 0
08:41:49.778116 IP 146.75.121.91.443 > 192.168.1.13.49860: Flags [P.], seq 141:169, ack 96, win 278, options [nop,nop,TS val 1011459339 ecr 1023039153], length 28
08:41:49.778142 IP 192.168.1.13.49860 > 146.75.121.91.443: Flags [.], ack 169, win 63, options [nop,nop,TS val 1023040225 ecr 1011459339], length 0
08:41:50.840533 IP 146.75.121.91.443 > 192.168.1.13.49860: Flags [P.], seq 169:197, ack 96, win 278, options [nop,nop,TS val 1011460402 ecr 1023040225], length 28
08:41:50.840550 IP 192.168.1.13.49860 > 146.75.121.91.443: Flags [.], ack 197, win 63, options [nop,nop,TS val 1023041288 ecr 1011460402], length 0
08:41:52.025215 IP 146.75.121.91.443 > 192.168.1.13.49860: Flags [P.], seq 197:225, ack 96, win 278, options [nop,nop,TS val 1011461586 ecr 1023041288], length 28
08:41:52.025258 IP 192.168.1.13.49860 > 146.75.121.91.443: Flags [.], ack 225, win 63, options [nop,nop,TS val 1023042472 ecr 1011461586], length 0
08:41:53.328449 IP 192.168.1.13.49860 > 146.75.121.91.443: Flags [P.], seq 96:128, ack 225, win 63, options [nop,nop,TS val 1023043776 ecr 1011461586], length 32
08:41:53.387187 IP 146.75.121.91.443 > 192.168.1.13.49860: Flags [.], ack 128, win 278, options [nop,nop,TS val 1011462948 ecr 1023043776], length 0
08:41:54.881847 IP 140.82.112.26.443 > 192.168.1.13.40736: Flags [P.], seq 243929865:243929891, ack 172794245, win 163, options [nop,nop,TS val 2675292759 ecr 154359129], length 26
08:41:54.881963 IP 192.168.1.13.40736 > 140.82.112.26.443: Flags [P.], seq 1:31, ack 26, win 75, options [nop,nop,TS val 154419130 ecr 2675292759], length 30
08:41:55.031617 IP 140.82.112.26.443 > 192.168.1.13.40736: Flags [.], ack 31, win 163, options [nop,nop,TS val 2675292909 ecr 154419130], length 0
08:41:55.297929 IP 192.168.1.13.39170 > 185.199.108.133.443: Flags [P.], seq 2027578314:2027578353, ack 1106276498, win 84, options [nop,nop,TS val 221079506 ecr 2864377405], length 39
08:41:55.298105 IP 192.168.1.13.39170 > 185.199.108.133.443: Flags [P.], seq 39:63, ack 1, win 84, options [nop,nop,TS val 221079506 ecr 2864377405], length 24
08:41:55.298114 IP 192.168.1.13.39170 > 185.199.108.133.443: Flags [F.], seq 63, ack 1, win 84, options [nop,nop,TS val 221079506 ecr 2864377405], length 0
08:41:55.348216 IP 185.199.108.133.443 > 192.168.1.13.39170: Flags [.], ack 63, win 280, options [nop,nop,TS val 2864431058 ecr 221079506], length 0
08:41:55.348217 IP 185.199.108.133.443 > 192.168.1.13.39170: Flags [.], ack 0, win 280, options [nop,nop,TS val 2864431058 ecr 221025903,nop,nop,sack 1 {39:63}], length 0
08:41:55.348698 IP 185.199.108.133.443 > 192.168.1.13.39170: Flags [P.], seq 1:25, ack 63, win 280, options [nop,nop,TS val 2864431058 ecr 221079506], length 24
08:41:55.348720 IP 192.168.1.13.39170 > 185.199.108.133.443: Flags [R], seq 2027578377, win 0, length 0
08:41:55.348943 IP 185.199.108.133.443 > 192.168.1.13.39170: Flags [F.], seq 25, ack 63, win 280, options [nop,nop,TS val 2864431058 ecr 221079506], length 0
08:41:55.348955 IP 192.168.1.13.39170 > 185.199.108.133.443: Flags [R], seq 2027578377, win 0, length 0
08:41:55.350417 IP 185.199.108.133.443 > 192.168.1.13.39170: Flags [.], ack 64, win 280, options [nop,nop,TS val 2864431060 ecr 221079506], length 0
08:41:55.350429 IP 192.168.1.13.39170 > 185.199.108.133.443: Flags [R], seq 2027578378, win 0, length 0
08:41:55.642891 IP 146.75.121.91.443 > 192.168.1.13.49860: Flags [P.], seq 225:253, ack 128, win 278, options [nop,nop,TS val 1011465204 ecr 1023043776], length 28
08:41:55.642907 IP 192.168.1.13.49860 > 146.75.121.91.443: Flags [.], ack 253, win 63, options [nop,nop,TS val 1023046090 ecr 1011465204], length 0
^C
113 packets captured
113 packets received by filter
0 packets dropped by kernel

```

**Comment by uncor3** [comment]
@medaminezghal What distro are you using ? We had a similar issue sometime ago and he solved it by enabling one of those ports, for me (Arch Linux) i didn't even have to allow any port it just worked as is.

**Comment by medaminezghal** [comment]
@uncor3 I’m using Arch Linux with KDE Plasma and firewalld as firewall backend.

**Comment by medaminezghal** [comment]
@uncor3 I've tried allowing [the ports recommended by the UxPlay Documentation](https://github.com/iDescriptor/uxplay?tab=readme-ov-file#2-uxplay-starts-but-stalls-after-initialized-server-sockets-appears-with-the-server-name-showing-on-the-client-but-the-client-fails-to-connect-when-the-uxplay-server-is-selected), but it didn't works, even I tried to allow the port that has been used yesterday and still same problem. it seems that UxPlay use random ports between 1024-65535.

**Comment by medaminezghal** [comment]
@uncor3 Maybe editing [this function](https://github.com/iDescriptor/iDescriptor/blob/e83bbde79045dc339558ef69891b760db14f4d25/src/airplaywidget.cpp#L70) by adding `-p` to use the recommended ports will fix the problem.

**Comment by medaminezghal** [comment]
@uncor3 Yes I can confirm: adding `-p` to the source and allowing those ports fixed the problem.
```
sudo firewall-cmd --add-port=7000/tcp --permanent
sudo firewall-cmd --add-port=7001/tcp --permanent
sudo firewall-cmd --add-port=7100/tcp --permanent
sudo firewall-cmd --add-port=6000/udp --permanent
sudo firewall-cmd --add-port=6001/udp --permanent
sudo firewall-cmd --add-port=7011/udp --permanent
sudo firewall-cmd --reload
```

**Comment by uncor3** [comment]
Added [AIRPLAY.md](https://github.com/iDescriptor/iDescriptor/blob/main/AIRPLAY.md) and starting from v0.5.0 we also pass `-p` to launch args thanks @medaminezghal
